{
  "schema": 1,
  "year": 1922,
  "src": {
    "file": "Хроника конфликта/1922.docx",
    "no": null,
    "ns": "chronicle",
    "group": null,
    "sha256": "557cf621710ce20713e7ff4afca38e2b8ae9975dc0ded2ad7381022586734509",
    "parser": "1.0.0"
  },
  "items": [
    {
      "id": "ch-1922-001",
      "year": 1922,
      "row": 1,
      "sort": "1922-02-05#0001",
      "kind": "event",
      "date": {
        "raw": "5–14 февраля",
        "display_ru": "5–14 февраля 1922 г.",
        "from": "1922-02-05",
        "to": "1922-02-14",
        "precision": "day",
        "style": "single"
      },
      "track": "mil",
      "pol_ru": null,
      "mil_ru": "Волочаевское сражение. Разгром Белоповстанческой армии В. М. Молчанова силами Народно-революционной армии [Дальневосточной Республики](#/state/fer) под командованием ***В. К. Блюхера***. Хабаровск вновь перешел под контроль советской власти.",
      "pol_en": null,
      "mil_en": null,
      "card": "volochaevskaya-operatsiya",
      "refs": {
        "states": [
          "fer"
        ]
      },
      "weight": 3
    },
    {
      "id": "ch-1922-002",
      "year": 1922,
      "row": 2,
      "sort": "1922-02-06#0002",
      "kind": "event",
      "date": {
        "raw": "6 февраля",
        "display_ru": "6 февраля 1922 г.",
        "from": "1922-02-06",
        "to": "1922-02-06",
        "precision": "day",
        "style": "single"
      },
      "track": "pol",
      "pol_ru": "Реорганизация Всероссийской чрезвычайной комиссии по борьбе с контрреволюцией и саботажем (ВЧК) в Главное политическое управление (ГПУ) при НКВД [РСФСР](#/state/rsfsr).",
      "mil_ru": null,
      "pol_en": null,
      "mil_en": null,
      "card": null,
      "refs": {
        "states": [
          "rsfsr"
        ]
      },
      "weight": 1
    },
    {
      "id": "ch-1922-003",
      "year": 1922,
      "row": 3,
      "sort": "1922-03-12#0003",
      "kind": "event",
      "date": {
        "raw": "12 марта",
        "display_ru": "12 марта 1922 г.",
        "from": "1922-03-12",
        "to": "1922-03-12",
        "precision": "day",
        "style": "single"
      },
      "track": "pol",
      "pol_ru": "Создание Федеративного Союза Социалистических Советских Республик Закавказья (ФСССРЗ) в составе ***Грузинской, Армянской и Азербайджанской Социалистических Советских Республик***.",
      "mil_ru": null,
      "pol_en": null,
      "mil_en": null,
      "card": null,
      "refs": {},
      "weight": 1
    },
    {
      "id": "ch-1922-004",
      "year": 1922,
      "row": 4,
      "sort": "1922-04-03#0004",
      "kind": "event",
      "date": {
        "raw": "3 апреля",
        "display_ru": "3 апреля 1922 г.",
        "from": "1922-04-03",
        "to": "1922-04-03",
        "precision": "day",
        "style": "single"
      },
      "track": "pol",
      "pol_ru": "На пленуме ЦК [РКП(б)](#/party/bolsheviks) Генеральным секретарем ЦК партии избран ***И. В. Сталин***.",
      "mil_ru": null,
      "pol_en": null,
      "mil_en": null,
      "card": null,
      "refs": {
        "parties": [
          "bolsheviks"
        ]
      },
      "weight": 1
    },
    {
      "id": "ch-1922-005",
      "year": 1922,
      "row": 5,
      "sort": "1922-04-10#0005",
      "kind": "event",
      "date": {
        "raw": "10 апреля – 20 мая",
        "display_ru": "10 апреля – 20 мая 1922 г.",
        "from": "1922-04-10",
        "to": "1922-05-20",
        "precision": "day",
        "style": "single"
      },
      "track": "pol",
      "pol_ru": "Международная конференция в Генуе (Италия) по экономическим и финансовым вопросам послевоенного урегулирования в Европе. На конференции обсуждался вопрос о признании [Советской Россией](#/state/rsfsr) долгов и финансовых обязательств прежних российских режимов (включая царский). Хотя каких-то решений принято не было, сам факт участия в конференции имел большое значение для [РСФСР](#/state/rsfsr), которая на тот момент де юре не признавалась западными державами.",
      "mil_ru": null,
      "pol_en": null,
      "mil_en": null,
      "card": null,
      "refs": {
        "states": [
          "rsfsr"
        ]
      },
      "weight": 1
    },
    {
      "id": "ch-1922-006",
      "year": 1922,
      "row": 6,
      "sort": "1922-04-16#0006",
      "kind": "event",
      "date": {
        "raw": "16 апреля",
        "display_ru": "16 апреля 1922 г.",
        "from": "1922-04-16",
        "to": "1922-04-16",
        "precision": "day",
        "style": "single"
      },
      "track": "pol",
      "pol_ru": "Рапалльский договор между [РСФСР](#/state/rsfsr) и ***Германией*** о восстановлении дипломатических отношений и урегулировании спорных вопросов военного и экономического характера. Заключен во время Генуэзской конференции в городе Рапалло (Италия). Обе стороны договорились о взаимном отказе от возмещения военных расходов и убытков. Признание [РСФСР](#/state/rsfsr) ***Германией*** означало прорыв дипломатической изоляции [Советской России](#/state/rsfsr).",
      "mil_ru": null,
      "pol_en": null,
      "mil_en": null,
      "card": null,
      "refs": {
        "states": [
          "rsfsr"
        ]
      },
      "weight": 1
    },
    {
      "id": "ch-1922-007",
      "year": 1922,
      "row": 7,
      "sort": "1922-06-06#0007",
      "kind": "event",
      "date": {
        "raw": "6 июня",
        "display_ru": "6 июня 1922 г.",
        "from": "1922-06-06",
        "to": "1922-06-06",
        "precision": "day",
        "style": "single"
      },
      "track": "pol",
      "pol_ru": "Создание в [РСФСР](#/state/rsfsr) Главного управления по делам литературы и издательств (Главлит), взявшего на себя функции цензуры.",
      "mil_ru": null,
      "pol_en": null,
      "mil_en": null,
      "card": null,
      "refs": {
        "states": [
          "rsfsr"
        ]
      },
      "weight": 1
    },
    {
      "id": "ch-1922-008",
      "year": 1922,
      "row": 8,
      "sort": "1922-06-08#0008",
      "kind": "event",
      "date": {
        "raw": "8 июня – 7 августа",
        "display_ru": "8 июня – 7 августа 1922 г.",
        "from": "1922-06-08",
        "to": "1922-08-07",
        "precision": "day",
        "style": "single"
      },
      "track": "pol",
      "pol_ru": "Суд над членами Центрального комитета ***Партии социалистов-революционеров (ПСР)*** в Москве. На показательном процессе эсеровское руководство обвинялось в организации терактов против [большевистских](#/party/bolsheviks) лидеров в 1918 г. (убийства ***М. С. Урицкого*** и В. Володарского, покушение на [В. И. Ленина](#/person/lenin)). 12 человек, в том числе 8 членов ЦК [ПСР](#/party/srs), приговорены Верховным трибуналом ВЦИК к смертной казни условно (приговор должны были привести в исполнение в случае возобновления [эсерами](#/party/srs) вооружённой борьбы против советской власти).",
      "mil_ru": null,
      "pol_en": null,
      "mil_en": null,
      "card": null,
      "refs": {
        "parties": [
          "bolsheviks",
          "srs"
        ],
        "persons": [
          "lenin"
        ]
      },
      "weight": 1
    },
    {
      "id": "ch-1922-009",
      "year": 1922,
      "row": 9,
      "sort": "1922-08-10#0009",
      "kind": "event",
      "date": {
        "raw": "10 августа",
        "display_ru": "10 августа 1922 г.",
        "from": "1922-08-10",
        "to": "1922-08-10",
        "precision": "day",
        "style": "single"
      },
      "track": "pol",
      "pol_ru": "ВЦИК принял декрет «Об административной высылке», по которому НКВД получил право массово высылать представителей интеллигенции за границу или ссылать их вглубь страны.",
      "mil_ru": null,
      "pol_en": null,
      "mil_en": null,
      "card": null,
      "refs": {},
      "weight": 1
    },
    {
      "id": "ch-1922-010",
      "year": 1922,
      "row": 10,
      "sort": "1922-06-15#0010",
      "kind": "event",
      "date": {
        "raw": "15 июня – 19 июля",
        "display_ru": "15 июня – 19 июля 1922 г.",
        "from": "1922-06-15",
        "to": "1922-07-19",
        "precision": "day",
        "style": "single"
      },
      "track": "pol",
      "pol_ru": "Международная финансово-экономическая конференция в Гааге (Нидерланды). Состоялась по решению Генуэзской конференции. Представители западных держав требовали от [РСФСР](#/state/rsfsr) возвращения бывшим владельцам ранее национализированного имущества иностранных капиталистов и признания долгов царского и ***Временного*** правительств. Советская делегация отклонила эти требования.",
      "mil_ru": null,
      "pol_en": null,
      "mil_en": null,
      "card": null,
      "refs": {
        "states": [
          "rsfsr"
        ]
      },
      "weight": 1
    },
    {
      "id": "ch-1922-011",
      "year": 1922,
      "row": 11,
      "sort": "1922-07-23#0011",
      "kind": "event",
      "date": {
        "raw": "23 июля – 10 августа",
        "display_ru": "23 июля – 10 августа 1922 г.",
        "from": "1922-07-23",
        "to": "1922-08-10",
        "precision": "day",
        "style": "single"
      },
      "track": "pol",
      "pol_ru": "Работа Приамурского земского собора во Владивостоке. Собор провозгласил восстановление верховной власти династии Романовых. Упразднение Временного Приамурского правительства во главе с С. Д. Меркуловым и избрание 5 августа временным диктатором генерала ***М. К. Дитерихса***. Указом № 1 от 8 августа [Дитерихс](#/person/diterikhs) переименовал Приамурское государственное образование в [Приамурский Земский Край](#/state/priamur-state), армию – в Земскую рать ([Дитерихс](#/person/diterikhs) сам возглавил ее, став Земским воеводой).",
      "mil_ru": null,
      "pol_en": null,
      "mil_en": null,
      "card": null,
      "refs": {
        "persons": [
          "diterikhs"
        ],
        "states": [
          "priamur-state"
        ]
      },
      "weight": 1
    },
    {
      "id": "ch-1922-012",